{
  "contract_version": "1.0",
  "decision_id": "izin-0001",
  "run_id": "kosu-2026-09-08-1455",
  "step_id": "belge-yaz",
  "at": "2026-09-08T15:02:00+03:00",
  "requester": { "kind": "agent", "id": "kod-gozden-gecirici" },
  "action": {
    "tool": "Write",
    "operation": "write",
    "summary": "Mimari belgesini docs/mimari altına yaz",
    "arguments_digest": "sha256:005c3d8d329d94054dbcb53eeef1f615363df47d3e8332b9f5a8e466b0d1f8d6"
  },
  "scope": ["D:/Repolar/ajans-os/docs/mimari/05-GUVENLIK.md"],
  "irreversible": false,
  "severity": "dusuk",
  "reliability": "guclu",
  "checks": [
    { "id": "kapsam-eslesme", "result": "gecti", "detail": "Yol, ajan sözleşmesinin permissions.filesystem.write glob'una giriyor." },
    { "id": "sabit-sinir-taramasi", "result": "gecti" }
  ],
  "hard_limit": { "hit": false },
  "decision": "ALLOW",
  "reason": "Salt yazma, kapsam içi, telafisi var (dosya sürümlü depoda).",
  "binding": {
    "component": "claude-code:Write",
    "version": "2.0",
    "digest": "sha256:a799904fe4a3f56cd370303d6c158698fc624bd6246b76d83d124e8ada1d10ff"
  },
  "grant": { "mode": "tek-cagri" }
}
